family,varied_parameter,adequacy_question,result,primary_value,max_mc_abs_error,details
Synchronous chain,"Length k, theta, rho",Does simulation match the node+edge closed form?,closed form matched; max MC error 0.0014,0.001355,0.001355,Exact availability ranged from 0.1668 to 0.9703; max 95% CI half-width 0.0022.
Fan-out,"Branching degree d, edge reliability rho",How quickly do mandatory AND dependencies degrade availability?,d=1->12 drops 0.894->0.364,0.530178022559,0.0011780225588,"At theta=0.97, rho=0.95, absolute drop was 0.530."
Replicated bottleneck,"Replica count R(v), fixed rho_e",Does replication help against node failures but saturate at an edge bottleneck?,"R=1->12 rises 0.738->0.820, bounded by rho=0.82",8.20010725988e-13,0.0007050082,Remaining distance to edge bound at R=12 was 0.000000.
Node vs. edge sensitivity,Grid over theta and rho,When does edge reliability dominate node replication?,max replication gain 0.373; edge-dominant cells 94%,0.373125,,Mean gain was 0.155 in edge-dominant cells and 0.319 elsewhere.
Async side effect,Immediate Phi_Imm vs eventual Phi_Evt,Are async edges invariant only for immediate response?,immediate delta 0.000000; eventual lower by 0.289,0.289224906984,0.000759,Immediate exact availability 0.9033; eventual exact availability 0.6140.
Failure domain,Co-location and domain failure probability,What gap appears between product and correlated P?,product overestimates correlated reference by 0.094,0.09405,,Product baseline 0.9490; correlated reference 0.8550.
Timeout/hang,"Delay, timeout, retry count",Where does pure connectivity produce false positives?,max connectivity false positive 0.399; retries recover 0.318,0.39850539876,,Timed reference multiplies connectivity by the probability of at least one on-time attempt.
Trace incompleteness,Edge/instance omission rate,What bias follows from partial model discovery?,max abs bias 0.594; hidden deps overestimate by 0.118,0.594418594978,,Edge-only omissions underestimated by 0.594; replica undercount by 0.069.
